{
  "description": "The one board vocabulary (ADR-048 DEC-8.4). board_profile is the value of /etc/suderra/board in the signed OS image, the provisioning manifest board, the release statement board_profile and the release artifact name (artifact-naming.json); every other vocabulary (Suderra OS build targets, USB payload families, cloud DeviceModel, RAUC compatible, cargo features, Rust target) is mapped onto it here and nowhere else. cloud_provisioning is the cloud's provisioning gate: the manifest service issues a manifest only for a board whose gate is open, and never for a board_profile that matches a pending family's pattern (SG-3).",
  "identity_cross_check_rule": "The image declares these values in /etc/suderra/board. At boot the live device-tree compatible (ARM) or DMI vendor/product (x86) must equal one of them; otherwise the agent runs in degraded mode and an alarm result is written (DEC-8.2). The list is never empty: a board without a cross-check value is not a board.",
  "feature_rule": "cargo_features is the exact feature set of the build: a release is built with --no-default-features and --features set to this list, and the signed release statement names the same list (release-profile-mismatch). The build must need no feature beyond it: a feature every Suderra OS build requires is implied by the suderra-os feature in the crate's Cargo.toml, as a feature dependency, and is never added by the release pipeline on top of this list. The agent crate currently does not compile without its health feature (EDGE-HIGH-128), so suderra-os must imply health and the release plan's crate_required_features must go; until then the signed statement misstates the build, which sens-api-gateway/release/edge-release.toml records as a tracked defect with an owner and a deadline.",
  "os_runtime": {
    "description": "The runtime every Suderra OS image provides to the agent binary (ADR-048 DEC-8.5, INFRA-MEDIUM-253): the C library and the shared libraries a release binary may link. The release pipeline checks a built binary against this table (ELF NEEDED, the program interpreter and the highest GLIBC symbol version), so a dependency that needs anything else fails the release before a device does. The values describe the Buildroot 2025.05.3 toolchain of every image (glibc 2.41, BR2_TOOLCHAIN_BUILDROOT_GLIBC on all boards) and the gcc runtime; a Suderra-OS image-contract test must compare the built rootfs with this table, so the table cannot drift from the images.",
    "libc": "glibc",
    "glibc_version": "2.41",
    "shared_libraries": {
      "x86_64": {
        "interpreter": "/lib64/ld-linux-x86-64.so.2",
        "needed": [
          "ld-linux-x86-64.so.2",
          "libc.so.6",
          "libdl.so.2",
          "libgcc_s.so.1",
          "libm.so.6",
          "libpthread.so.0",
          "librt.so.1"
        ]
      },
      "aarch64": {
        "interpreter": "/lib/ld-linux-aarch64.so.1",
        "needed": [
          "ld-linux-aarch64.so.1",
          "libc.so.6",
          "libdl.so.2",
          "libgcc_s.so.1",
          "libm.so.6",
          "libpthread.so.0",
          "librt.so.1"
        ]
      }
    }
  },
  "boards": [
    {
      "board_profile": "revpi-connect4",
      "role": "primary",
      "arch": "aarch64",
      "rust_target": "aarch64-unknown-linux-gnu",
      "agent_profile": "suderra-os",
      "cargo_features": ["revpi-io", "scada-display", "suderra-os"],
      "rauc_compatible": "suderra-os-revpi-connect4",
      "device_binding_method": "tpm-ek-sha256",
      "identity_cross_check": {
        "source": "device-tree-compatible",
        "values": ["kunbus,revpi-connect4"]
      },
      "cloud_device_models": ["revolution_pi_connect_4"],
      "cloud_provisioning": {
        "allowed": true,
        "blocked_by": [],
        "reason": "Provisioning is open; until SG-1 opens at P2 exit the cloud signs only monitoring-only site configs for it."
      },
      "os_images": [
        {
          "defconfig": "suderra_aarch64_revpi4_defconfig",
          "build_target": "revpi4"
        },
        {
          "defconfig": "suderra_aarch64_revpi4_prod_ab_defconfig",
          "build_target": "revpi4-prod-ab"
        }
      ]
    },
    {
      "board_profile": "rpi4-cm4",
      "role": "secondary",
      "arch": "aarch64",
      "rust_target": "aarch64-unknown-linux-gnu",
      "agent_profile": "suderra-os",
      "cargo_features": ["gpio", "scada-display", "suderra-os"],
      "rauc_compatible": "suderra-os-rpi4-cm4",
      "device_binding_method": "bcm2711-serial-otp-sha256",
      "identity_cross_check": {
        "source": "device-tree-compatible",
        "values": ["raspberrypi,4-compute-module", "raspberrypi,4-model-b"]
      },
      "cloud_device_models": ["raspberry_pi_4"],
      "cloud_provisioning": {
        "allowed": false,
        "blocked_by": ["EDGE-MEDIUM-120"],
        "reason": "How the TPM-less RPi4/CM4 is used in production is an open operator decision (ADR-048 Soru 3, DEC-8.11); the cloud issues no manifest for it until that decision amends this gate."
      },
      "os_images": [
        {
          "defconfig": "suderra_aarch64_rpi4_defconfig",
          "build_target": "rpi4"
        },
        {
          "defconfig": "suderra_aarch64_rpi4_prod_ab_defconfig",
          "build_target": "rpi4-prod-ab"
        }
      ]
    },
    {
      "board_profile": "qemu-x86_64",
      "role": "ci",
      "arch": "x86_64",
      "rust_target": "x86_64-unknown-linux-gnu",
      "agent_profile": "suderra-os",
      "cargo_features": ["scada-display", "suderra-os"],
      "rauc_compatible": "suderra-os-qemu-x86_64",
      "device_binding_method": "tpm-ek-sha256",
      "identity_cross_check": {
        "source": "dmi-allowlist",
        "values": ["QEMU"]
      },
      "cloud_device_models": [],
      "cloud_provisioning": {
        "allowed": false,
        "blocked_by": ["ci-only"],
        "reason": "CI and dev target: only the fake cloud of the QEMU e2e test (Suderra-OS tests/qemu/fake_cloud.py) provisions it, and no DeviceModel maps to it."
      },
      "os_images": [
        {
          "defconfig": "suderra_qemu_x86_64_defconfig",
          "build_target": "qemu-x86_64"
        },
        {
          "defconfig": "suderra_qemu_x86_64_prod_ab_defconfig",
          "build_target": "qemu-x86_64-prod-ab"
        }
      ]
    }
  ],
  "pending_board_families": [
    {
      "family": "x86-ipc",
      "board_profile_template": "x86-ipc-<model>",
      "board_profile_pattern": "^x86-ipc-[a-z0-9]+(-[a-z0-9]+)*$",
      "rauc_compatible_template": "suderra-os-x86-ipc-<model>",
      "arch": "x86_64",
      "rust_target": "x86_64-unknown-linux-gnu",
      "agent_profile": "suderra-os",
      "cargo_features": ["scada-display", "suderra-os"],
      "device_binding_method": "tpm-ek-sha256",
      "identity_cross_check_source": "dmi-allowlist",
      "cloud_device_models": ["industrial_pc"],
      "cloud_provisioning": {
        "allowed": false,
        "blocked_by": ["SG-3"],
        "reason": "No x86 unit is installed in the field before P1 exit (SG-3): the cloud issues no manifest for any board_profile matching board_profile_pattern."
      },
      "status": "No industrial x86 model is selected or qualified (DEC-8.1, DEC-8.9). Each qualified model becomes its own boards entry x86-ipc-<model> with its own RAUC compatible suderra-os-x86-ipc-<model> and DMI allowlist in a later contract version, so one model's image never installs on another (DEC-8.3). The model-independent x86 image below is the kernel and Secure Boot qualification base and declares no board_profile.",
      "os_images": [
        {
          "defconfig": "suderra_x86_64_defconfig",
          "build_target": "x86_64"
        }
      ]
    }
  ],
  "excluded_os_images": [
    {
      "defconfig": "suderra_aarch64_defconfig",
      "build_target": "generic-aarch64-template",
      "reason": "Unsupported template with no board, kernel or acceptance path; it runs no agent."
    },
    {
      "defconfig": "suderra_aarch64_rpi4_usb_installer_defconfig",
      "build_target": "pi-cm4-revpi-usb-installer",
      "reason": "USB self-installer that flashes the rpi4 and revpi4 payload images; it runs no agent."
    }
  ],
  "usb_payload_board_families": {
    "description": "The board_family and compatible_models vocabulary of the Suderra-OS USB installer payload index (board/suderra/common/post-image.sh, scripts/ci/package-usb-installer-payload.py, suderra.usb-payload-index.v1). It predates boards.json; this is its only mapping onto board_profile.",
    "families": {
      "revpi4": { "kind": "payload", "boards": ["revpi-connect4"] },
      "rpi4-cm4": { "kind": "payload", "boards": ["rpi4-cm4"] },
      "pi-cm4-revpi": { "kind": "installer-index", "boards": ["revpi-connect4", "rpi4-cm4"] }
    }
  },
  "unmapped_device_models": [
    {
      "device_model": "revolution_pi_compact",
      "reason": "No Suderra OS image targets the RevPi Compact; such devices stay on the generic-Linux channel (DEC-28)."
    },
    {
      "device_model": "raspberry_pi_5",
      "reason": "No Suderra OS image targets the Raspberry Pi 5; generic-Linux channel only (DEC-28)."
    },
    {
      "device_model": "raspberry_pi_4_lora",
      "reason": "The SX1302 LoRa concentrator needs the lorawan and sx1302-vendor-hal features, which no Suderra OS profile builds; generic-Linux channel only (DEC-28)."
    },
    {
      "device_model": "raspberry_pi_5_lora",
      "reason": "No Suderra OS image targets the Raspberry Pi 5 and no profile builds LoRa; generic-Linux channel only (DEC-28)."
    },
    {
      "device_model": "custom",
      "reason": "Unknown hardware has no signed board identity, so the cloud never issues a Suderra OS manifest for it (DEC-8.2)."
    }
  ]
}
